share,symbol,standard_deviation,expected_return,profile,upcoming_events,Analyst_Expected_Return
"Amazon.com, Inc.",AMZN,0.020578479,0.3,"Amazon.com, Inc. engages in the retail sale of consumer products, advertising, and subscriptions service through online and physical stores in North America and internationally. The company operates through three segments: North America, International, and Amazon Web Services (AWS). It also manufactures and sells electronic devices, including Kindle, fire tablets, fire TVs, echo, ring, blink, and eero; and develops and produces media content. In addition, the company offers programs that enable sellers to sell their products in its stores; and programs that allow authors, independent publishers, musicians, filmmakers, Twitch streamers, skill and app developers, and others to publish and sell content. Further, it provides compute, storage, database, analytics, machine learning, and other services, as well as advertising services through programs, such as sponsored ads, display, and video advertising. Additionally, the company offers Amazon Prime, a membership program. The company's products offered through its stores include merchandise and content purchased for resale and products offered by third-party sellers. It serves consumers, sellers, developers, enterprises, content creators, advertisers, and employees. Amazon.com, Inc. was incorporated in 1994 and is headquartered in Seattle, Washington.","April 28, 2025
Amazon.com, Inc. Earnings Date",0.5184
Novo Nordisk A/S,NVO,0.017997825,0.17,"Novo Nordisk A/S, together with its subsidiaries, engages in the research and development, manufacture, and distribution of pharmaceutical products in Europe, the Middle East, Africa, Mainland China, Hong Kong, Taiwan, North America, and internationally. It operates in two segments, Diabetes and Obesity Care, and Rare Disease. The Diabetes and Obesity care segment provides products for diabetes, obesity, cardiovascular, and other emerging therapy areas. The Rare Disease segment offers products in the areas of rare blood disorders, rare endocrine disorders, and hormone replacement therapy. The company also provides insulin pens, growth hormone pens, and injection needles. In addition, it offers smart solutions for diabetes treatment, such as smart insulin pens and Dose Check, an insulin dose guidance application. The company has a collaboration agreement with UNICEF to tackle childhood obesity; and with Valo Health, Inc. to discover and develop novel drug programmes for cardiometabolic space. Novo Nordisk A/S was founded in 1923 and is headquartered in Bagsvaerd, Denmark.","May 7, 2025
Novo Nordisk A/S Earnings Date",0.4455
SPDR S&P 500 ETF Trust,SPY,0.011110736,0.11,"The trust seeks to achieve its investment objective by holding a portfolio of the common stocks that are included in the index, with the weight of each stock in the portfolio substantially corresponding to the weight of such stock in the index.",,0.3039
Toyota Motor Corporation,TM,0.014199473,0.07,"Toyota Motor Corporation designs, manufactures, assembles, and sells passenger vehicles, minivans and commercial vehicles, and related parts and accessories in Japan, North America, Europe, Asia, Central and South America, Oceania, Africa, and the Middle East. It operates through Automotive, Financial Services, and All Other segments. The company offers subcompact and compact cars; mini-vehicles; mid-size, luxury, sports, and specialty cars; recreational and sport-utility vehicles; pickup trucks; minivans; trucks; and buses. It offers vehicles under the Toyota and Lexus brand names. Further, the company provides financial services, such as retail financing and leasing, wholesale financing, insurance, and credit cards. Additionally, it operates GAZOO.com, a web portal for automobile information, as well as engages in telecommunications and other businesses. The company also develops and sells battery electric vehicles and batteries. The company was founded in 1933 and is headquartered in Toyota, Japan.","May 6, 2025
Toyota Motor Corporation Earnings Date",0.25
"Tesla, Inc.",TSLA,0.036191952,0.44,"Tesla, Inc. designs, develops, manufactures, leases, and sells electric vehicles, and energy generation and storage systems in the United States, China, and internationally. The company operates in two segments, Automotive; and Energy Generation and Storage. The Automotive segment offers electric vehicles, as well as sells automotive regulatory credits; and non-warranty after-sales vehicle, used vehicles, body shop and parts, supercharging, retail merchandise, and vehicle insurance services. This segment also provides sedans and sport utility vehicles through direct and used vehicle sales, a network of Tesla Superchargers, and in-app upgrades; purchase financing and leasing services; services for electric vehicles through its company-owned service locations and Tesla mobile service technicians; and vehicle limited warranties and extended service plans. The Energy Generation and Storage segment engages in the design, manufacture, installation, sale, and leasing of solar energy generation and energy storage products, and related services to residential, commercial, and industrial customers and utilities through its website, stores, and galleries, as well as through a network of channel partners. This segment also provides services and repairs to its energy product customers, including under warranty; and various financing options to its residential customers. The company was formerly known as Tesla Motors, Inc. and changed its name to Tesla, Inc. in February 2017. Tesla, Inc. was incorporated in 2003 and is headquartered in Austin, Texas.","April 23, 2025
Tesla, Inc. Earnings Date",0.4598
Teva Pharmaceutical Industries Limited,TEVA,0.02888554,0.19,"Teva Pharmaceutical Industries Limited develops, manufactures, markets, and distributes generic and other medicines, and biopharmaceutical products in the United States, Europe, Israel, and internationally. It offers generic medicines in various dosage forms, such as tablets, capsules, injectables, inhalants, liquids, transdermal patches, ointments, and creams; sterile products, hormones, high-potency drugs, and cytotoxic substances in parenteral and solid dosage forms; and generic products with medical devices and combination products. The company also focuses on the central nervous system (CNS), respiratory, and oncology areas. It provides active pharmaceutical ingredients, as well as contract manufacturing services; and operates an out-licensing platform that offers a portfolio of products to other pharmaceutical companies. The company also offers BENDEKA and TREANDA injections for the treatment of chronic lymphocytic leukemia and indolent b-cell non-hodgkin's lymphoma; COPAXONE to treat patients with relapsing forms of multiple sclerosis; AJOVY for the preventive treatment of migraine in adults; AUSTEDO to treat neurodegenerative and movement disorders  chorea associated with Huntington's disease and tardive dyskinesia; UZEDY for the treatment of schizophrenia; ProAir RespiClick inhalation powder; QVAR RediHaler to treat asthma; BRALTUS, a long-acting muscarinic antagonist; CINQAIR/CINQAERO injection; DuoResp Spiromax budesonide and formoterol powder inhaler; and AirDuo RespiClick fluticasone propionate and salmeterol inhalation powder. The company offers its OTC products under the SUDOCREM, NasenDuo, DICLOX FORTE, OLFEN Max, and FLEGAMINA brand names. It has collaboration agreements with MedinCell S.A.; Sanofi; Alvotech; and Biolojic Design Ltd., as well as license agreement with MODAG GmbH. The company was founded in 1901 and is based in Tel Aviv, Israel.","May 7, 2025
Teva Pharmaceutical Industries Limited Earnings Date",0.7815
"Robinhood Markets, Inc.",HOOD,,,"Robinhood Markets, Inc. operates financial services platform in the United States. Its platform allows users to invest in stocks, exchange-traded funds (ETFs), American depository receipts, options, gold, and cryptocurrencies. The company offers fractional trading, recurring investments, fully-paid securities lending, access to investing on margin, cash sweep, instant withdrawals, retirement program, around-the-clock trading, joint investing accounts, event contracts, and future contract services. It also provides various learning and education solutions comprise Snacks, an accessible digest of business news stories for a new generation of investors.; Learn, which is an online collection of guides, feature tutorials, and financial dictionary; Newsfeeds that offer access to free, premium news from sites from various sites, such as Barron's, Reuters, and Dow Jones. In addition, the company offers In-App Education, a resource that covers investing fundamentals, including why people invest, a stock market overview, and tips on how to define investing goals, as well as allows customers to understand the basics of investing before their first trade; and Crypto Learn and Earn, an educational module available to various crypto customers through Robinhood Learn to teach customers the basics related to cryptocurrency. Further, it provides Robinhood credit cards, cash card and spending accounts, and wallets. Robinhood Markets, Inc. was incorporated in 2013 and is headquartered in Menlo Park, California.","May 6, 2025 at 1:59 PM GMT+3 - May 12, 2025 at 3:00 PM GMT+3
Robinhood Markets, Inc. Earnings Date",0.4703
Invesco QQQ Trust,QQQ,0.013761794,0.17,"To maintain the correspondence between the composition and weights of the securities in the trust (the ""securities"") and the stocks in the NASDAQ-100 Index®, the adviser adjusts the securities from time to time to conform to periodic changes in the identity and/or relative weights of index securities. The composition and weighting of the securities portion of a portfolio deposit are also adjusted to conform to changes in the index.",,0.36
"Coinbase Global, Inc.",COIN,0.055830546,0.22,"Coinbase Global, Inc. operates platform for crypto assets in the United States and internationally. It offers the primary financial account in the crypto economy for consumers; a brokerage platform with a pool of liquidity across the crypto marketplace for institutions; and a suite of products granting access to build onchain for developers. The company was founded in 2012 and is based in New York, New York.","April 30, 2025 at 1:59 PM GMT+3 - May 5, 2025 at 3:00 PM GMT+3
Coinbase Global, Inc. Earnings Date",0.6708
Archer Aviation Inc.,ACHR,0.052637015,0.26,"Archer Aviation Inc., together with its subsidiaries, designs and develops aircraft and related technologies and services in the United States and internationally. It operates through the commercial and defense sectors. The company offers electric vertical takeoff and landing (eVTOL) aircraft for use in urban air mobility (UAM) and Archer Direct, a commercial aircraft. It also provides direct-to-consumer aerial ride share services and maintenance and repair services. The company was incorporated in 2018 and is headquartered in San Jose, California.","May 7, 2025 at 1:59 PM GMT+3 - May 12, 2025 at 3:00 PM GMT+3
Archer Aviation Inc. Earnings Date",0.6109
CBOE Interest Rate 10 Year T No,TNX,0.031093956,0.19,"TNX is the ticker symbol for the CBOE 10-Year Treasury Note Yield Index. It represents the yield (interest rate) of the U.S. government’s 10-year Treasury bond. Rather than tracking the bond price, TNX reflects the yield, which typically moves inversely to bond prices. It is a widely watched benchmark that indicates market sentiment about interest rates, inflation, and economic expectations.",,0.1
SPDR Gold Shares,GLD,0.008798691,0.1,"The Trust holds gold bars and from time to time, issues Baskets in exchange for deposits of gold and distributes gold in connection with redemptions of Baskets. The investment objective of the Trust is for the Shares to reflect the performance of the price of gold bullion, less the Trust’s expenses. The Sponsor believes that, for many investors, the Shares represent a cost-effective investment in gold.",,0.15
Alphabet Inc.,GOOG,0.017991615,0.22,"Alphabet Inc. offers various products and platforms in the United States, Europe, the Middle East, Africa, the Asia-Pacific, Canada, and Latin America. It operates through Google Services, Google Cloud, and Other Bets segments. The Google Services segment provides products and services, including ads, Android, Chrome, devices, Gmail, Google Drive, Google Maps, Google Photos, Google Play, Search, and YouTube. It is also involved in the sale of apps and in-app purchases and digital content in the Google Play and YouTube; and devices, as well as in the provision of YouTube consumer subscription services. The Google Cloud segment offers AI infrastructure, Vertex AI platform, cybersecurity, data and analytics, and other services; Google Workspace that include cloud-based communication and collaboration tools for enterprises, such as Calendar, Gmail, Docs, Drive, and Meet; and other services for enterprise customers. The Other Bets segment sells healthcare-related and internet services. The company was incorporated in 1998 and is headquartered in Mountain View, California.","April 23, 2025 at 11:00 PM GMT+3 - April 28, 2025 at 11:00 PM GMT+3
Alphabet Inc. Earnings Date",0.3717
Palantir Technologies Inc,PLTR,0.045812951,0.744616475,"Palantir Technologies Inc. builds and deploys software platforms for the intelligence community to assist in counterterrorism investigations and operations in the United States, the United Kingdom, and internationally. It provides Palantir Gotham, a software platform, which enables users to identify patterns hidden deep within datasets, ranging from signals intelligence sources to reports from confidential informants, as well as facilitates the hand-off between analysts and operational users, helping operators plan and execute real-world responses to threats that have been identified within the platform. The company also offers Palantir Foundry, a platform that transforms the ways organizations operate by creating a central operating system for their data; and allows individual users to integrate and analyze the data they need in one place. In addition, it provides Palantir Apollo, a software that delivers software and updates across the business, as well as enables customers to deploy their software virtually in any environment; and Palantir Artificial Intelligence Platform that provides unified access to open-source, self-hosted, and commercial large language models (LLMs) that can transform structured and unstructured data into LLM-understandable objects and can turn organizations' actions and processes into tools for humans and LLM-driven agents. The company was incorporated in 2003 and is headquartered in Denver, Colorado.","May 5, 2025 at 11:00 PM GMT+3 Palantir Technologies Inc. Earnings Date",
"Micron Technology, Inc.",MU,0.02970629,0.20066087,"Micron Technology, Inc. designs, develops, manufactures, and sells memory and storage products in the United States, Taiwan, Mainland China, rest of the Asia Pacific, Hong Kong, Japan, Europe, and internationally. The company operates through four segments: Compute and Networking Business Unit, Mobile Business Unit, Embedded Business Unit, and Storage Business Unit. It provides memory and storage technologies comprising dynamic random access memory semiconductor devices with low latency that provide high-speed data retrieval; non-volatile and re-writeable semiconductor storage devices; and non-volatile re-writable semiconductor memory devices that provide fast read speeds under the Micron and Crucial brands, as well as through private labels. The company offers serves the data center, PC, graphics, networking, automotive, industrial, and consumer embedded markets, as well as for smartphone and other mobile-device markets. It markets its products through its direct sales force, independent sales representatives, distributors, and retailers; and web-based customer direct sales channel, as well as through channel and distribution partners. Micron Technology, Inc. was founded in 1978 and is headquartered in Boise,","June 24, 2025 at 11:00 PM GMT+3 - June 30, 2025 at 11:00 PM GMT+3 Micron Technology, Inc. Earnings Date",
Arista Networks Inc ,ANET,0.027176353,0.388927174,"Arista Networks Inc engages in the development, marketing, and sale of data-driven, client to cloud networking solutions for AI, data center, campus, and routing environments in the Americas, Europe, the Middle East, Africa, and the Asia-Pacific. Its cloud networking solutions consist of Extensible Operating System (EOS), a publish-subscribe state-sharing networking operating system offered in combination with a set of network applications. The company offers data center, cloud and AI networking, cognitive adjacencies, and cognitive network software and services. It also provides post contract customer support services, such as technical support, hardware repair and replacement parts beyond standard warranty, bug fixes, patches, and upgrade services. The company serves a range of industries comprising internet companies, cloud service providers, financial services organizations, government agencies, media and entertainment, healthcare, oil and gas, education, manufacturing, industrial, and others. It markets and sells its products through distributors, system integrators, value-added resellers, and original equipment manufacturer partners, as well as through its direct sales force. The company was formerly known as Arastra, Inc. and changed its name to Arista Networks Inc in October 2008. Arista Networks Inc was incorporated in 2004 and is headquartered in Santa Clara, California.","May 6, 2025 at 11:00 PM GMT+3 Arista Networks Inc Earnings Date",
"Uber Technologies, Inc. ",UBER,0.033492853,0.234206757,"Uber Technologies, Inc. develops and operates proprietary technology applications in the United States, Canada, Latin America, Europe, the Middle East, Africa, and the Asia Pacific. It operates through three segments: Mobility, Delivery, and Freight. The Mobility segment connects consumers with a range of transportation modalities, such as ridesharing, carsharing, micromobility, rentals, public transit, taxis, and other modalities; and offers riders in a variety of vehicle types, as well as financial partnerships products and advertising services. The Delivery segment allows consumers to search for and discover restaurants to grocery, alcohol, convenience, and other retails, as well as order a meal or other items, and either pick-up at the restaurant or have it delivered; and provides Uber direct, a white-label delivery-as-a-service for retailers and restaurants, as well as advertising services. The Freight segment manages transportation and logistics network, which connects shippers and carriers in digital marketplace, including carriers upfronts, pricing, and shipment booking; and offers on-demand platform to automate logistics end-to-end transactions for small-and medium-sized business to global enterprises. The company was formerly known as Ubercab, Inc. and changed its name to Uber Technologies, Inc. in February 2011. Uber Technologies, Inc. was founded in 2009 and is headquartered in San Francisco, California.","May 6, 2025 at 3:30 PM GMT+3 - May 12, 2025 at 3:30 PM GMT+3 Uber Technologies, Inc. Earnings Date",
"Super Micro Computer, Inc.",SMCI,0.042161842,0.448082609,"Super Micro Computer, Inc., together with its subsidiaries, develops and sells high performance server and storage solutions based on modular and open architecture in the United States, Europe, Asia, and internationally. It offers various IT solutions, including complete servers, storage systems, modular blade servers, blades, workstations, full-rack scale solutions, networking devices, server sub-systems, and server management and security software. The company also provides application-optimized server solutions, rackmount and blade servers, storage, and subsystems and accessories; and server software management solutions, such as Server Management Suite, including Supermicro Server Manager, Supermicro Power Management software, Supermicro Update Manager, SuperCloud Composer, and SuperDoctor 5. In addition, it offers server subsystems and accessories comprising server boards, chassis, power supplies, and other accessories. Further, the company identifies service requirements, creates and executes project plans, conducts verification testing and training activities, and provides technical documentation services. Additionally, it offers help desk and on-site support services for its server and storage systems; and customer support services, including ongoing maintenance and technical support for its products. The company provides its products to enterprise data centers, cloud computing, artificial intelligence, 5G, and edge computing markets. It sells its products through direct and indirect sales force, distributors, value-added resellers, system integrators, and original equipment manufacturers. The company was incorporated in 1993 and is headquartered in San Jose, California.","April 28, 2025 at 1:59 PM GMT+3 - May 2, 2025 at 3:00 PM GMT+3 Super Micro Computer, Inc. Earnings Date",
"NIKE, Inc.",NKE,0.018772128,0.071745652,"NIKE, Inc., together with its subsidiaries, engages in the design, development, marketing, and sale of athletic footwear, apparel, equipment, accessories, and services worldwide. The company provides athletic and casual footwear, apparel, and accessories under the NIKE, Jumpman, Converse, Chuck Taylor, All Star, One Star, Star Chevron, and Jack Purcell trademarks. It also sells a line of performance equipment and accessories comprising bags, sport balls, socks, eyewear, timepieces, digital devices, bats, gloves, protective equipment, and other equipment for sports activities under the NIKE brand; and various plastic products to other manufacturers. In addition, the company markets apparel with licensed college and professional team, and league logos, as well as sells sports apparel; licenses unaffiliated parties to manufacture and sell apparel, digital devices, and applications and other equipment for sports activities under NIKE-owned trademarks; and operates digital platforms, including fitness and activity apps; sport, fitness, and wellness content; and digital services and features in retail stores. It sells its products to footwear stores; sporting goods stores; athletic specialty stores; department stores; skate, tennis, and golf shops; and other retail accounts through NIKE-owned retail stores, digital platforms, independent distributors, licensees, and sales representatives. The company was founded in 1964 and is headquartered in Beaverton, Oregon.","June 25, 2025 at 1:59 PM GMT+3 - June 30, 2025 at 3:00 PM GMT+3 NIKE, Inc. Earnings Date",
GameStop Corp.,GME,0.073223943,0.680390217,"GameStop Corp., a specialty retailer, provides games and entertainment products through its stores and e-commerce platforms in the United States, Canada, Australia, and Europe. The company sells new and pre-owned gaming platforms; accessories, such as controllers, and gaming headsets; new and pre-owned gaming software; and in-game digital currency, digital downloadable content, and full-game downloads. It sells collectibles comprising apparel, toys, trading cards, gadgets, and other retail products for pop culture and technology enthusiasts. The company operates stores and e-commerce sites under the GameStop, EB Games, and Micromania brands; and pop culture themed stores that sell collectibles, apparel, gadgets, electronics, toys, and other retail products under the Zing Pop Culture brand. The company was formerly known as GSC Holdings Corp. GameStop Corp. was founded in 1996 and is headquartered in Grapevine, Texas.","June 9, 2025 at 11:00 PM GMT+3 - June 13, 2025 at 11:00 PM GMT+3 GameStop Corp. Earnings Date",
